{
  "schema_version": 1,
  "status": "complete",
  "automation_consumption": false,
  "target_id": "parakeet-tdt_ctc-0.6b-ja",
  "upstream": {
    "repo_id": "nvidia/parakeet-tdt_ctc-0.6b-ja",
    "revision": "0123456789abcdef0123456789abcdef01234567"
  },
  "development_repo": {
    "repo_id": "gawohok7/jpapt-v2.2-dev",
    "revision": "89abcdef0123456789abcdef0123456789abcdef"
  },
  "assets": [
    {
      "path": "onnx/ctc/model.onnx",
      "kind": "onnx",
      "sha256": "aaaaaaaaaaaaaaaaaaaaaaaaaaaaaaaaaaaaaaaaaaaaaaaaaaaaaaaaaaaaaaaa",
      "origin": {
        "repo_id": "gawohok7/jpapt-v2.2-dev",
        "revision": "89abcdef0123456789abcdef0123456789abcdef",
        "path": "onnx/ctc/model.onnx"
      },
      "license": "CC-BY-4.0",
      "attribution": "NVIDIA NeMo Parakeet upstream attribution",
      "transformation": {
        "kind": "converted",
        "tool": "nemo-onnx-export",
        "version": "1.0.0",
        "input_sha256": "bbbbbbbbbbbbbbbbbbbbbbbbbbbbbbbbbbbbbbbbbbbbbbbbbbbbbbbbbbbbbbbb",
        "output_sha256": "aaaaaaaaaaaaaaaaaaaaaaaaaaaaaaaaaaaaaaaaaaaaaaaaaaaaaaaaaaaaaaaa"
      },
      "candidate": {
        "path": "ctc/model.onnx",
        "sha256": "aaaaaaaaaaaaaaaaaaaaaaaaaaaaaaaaaaaaaaaaaaaaaaaaaaaaaaaaaaaaaaaa",
        "role": "primary"
      }
    }
  ],
  "blockers": []
}
